{
  "$schema": "http://json-schema.org/draft-04/schema#",
  "description": "Describe all the PPA Information included in the ZoneData object",
  "type": "object",
  "required": [
    "id",
    "name",
    "creator",
    "usage",
	"terminated",
	"zone"
	
  ],
  "properties": {
    "id": {
      "type": "string",
      "description": "id of zone Format: zone/$CREATOR/$ZONE_ID",
	  "pattern" : "zone/.+/.+"
	},
	"name": {
      "type": "string",
      "description": "Human-readable local significant string. The name of this zone."
	},
    "creator": {
      "type": "string",
      "description": "Duman-readable local significant string. The name creator one of (SAS Administrator record ID , Static government zone definition source ID)."
    },
    "usage": {
      "type": "string",
       "enum": [ "CENSUS_TRACT", "PPA", "EXCLUSION_ZONE"],
      "description": "Enumeration describing the usage of the zone."
    },
	"terminated": {
      "type": "boolean",
      "description": "Indicates whether the zone is currently terminated or not"
    },
	"ppaInfo": {
	"$ref": "file:PpaInformation.schema.json"
    },
	"zone": {
	"$ref": "file:Zone.schema.json"
    }
  },
  
   "oneOf": [
      {
         "properties": {
             "usage": {"enum": ["PPA"] }
         },
         "required": ["ppaInfo"]
      },
	  {
         "properties": {
             "usage": {"enum": ["CENSUS_TRACT", "EXCLUSION_ZONE"] }
         }
      }
	  ]
}