{
  "id": "PPA_P_0333",
  "name": "PPA Zone 2",
  "creator": "admin_2",
  "usage": "PPA",
  "terminated": false,
  "ppaInfo": {
        "ppaRegionType": "RURAL",
        "cbsdReferenceId": [
          "cbsd_3"
        ],
        "palId": [
          "pal_3"        ],
        "ppaBeginDate": "2016-01-02 08:26:55",
        "ppaExpirationDate": "2020-01-02 08:26:55" 
      },
  "zone": {
    "type": "FeatureCollection",
    "features": [
      {
        "type": "Feature",
        "properties": {},
        "geometry": {
          "type": "Polygon",
          "coordinates": [
              [
              [
                        -120.20,
                        34.75
                     ],
                     [
                        -120.15,
                        34.75
                     ],
                     [
                        -120.15,
                        34.70
                     ],
                     [
                        -120.20,
                        34.70
                     ],
                     [
                        -120.20,
                        34.75
                     ]
                ]
          ]
        }
      }
    ]
  }
}
