{"id":"zone/ppa/SAS_Admin_1/1","name":"PPA Zone 0","creator":"SAS_Admin_1","usage":"PPA","terminated":false,"ppaInfo":{"palId":["pal/05-2017/20041084200/A"],"ppaBeginDate":"2017-05-01T00:00:00Z","ppaExpirationDate":"2017-05-01T00:00:00Z","cbsdReferenceId":["CBSD_228_RED/c36153d7b423721145f3f3ac9e28bd02211ff03a"]},"zone":{"features":[{"geometry":{"coordinates":[[[-97.2386169433594,38.8653748516116],[-97.3196411132812,38.7615795117574],[-97.1699523925781,38.7390884418769],[-97.1617126464844,38.867513370012],[-97.2386169433594,38.8653748516116]]],"type":"Polygon"},"properties":{},"type":"Feature"}],"type":"FeatureCollection"}}