{
  "id": "PPA_0",
  "name": "PPA Zone 0",
  "creator": "admin_0",
  "usage": "PPA",
  "terminated": false,
  "ppaInfo": {
        "ppaRegionType": "RURAL",
        "cbsdReferenceId": [
          "cbsd_5",
          "cbsd_3"
        ],
        "palId": [
          "pal_0",
          "pal_1",
          "pal_2"
        ],
        "ppaBeginDate": "2016-01-02 08:26:55",
        "ppaExpirationDate": "2020-01-02 08:26:55" 
      },
  "zone": {
    "type": "FeatureCollection",
    "features": [
      {
        "type": "Feature",
        "properties": {},
        "geometry": {
          "type": "Polygon",
          "coordinates": [
              [
                     [
                       -101.48221, 40.50541
                     ],
                     [
                       -101.50371, 40.50972
                     ],
                     [
                       -101.51766, 40.48919
                     ],
                     [
                       -101.49036, 40.48978
                     ]
                ]
          ]
        }
      }
    ]
  }
}
